<?xml version="1.0" encoding="UTF-8"?>

<Flowers xmlns:xsi="http://www.w3.org/2001/XMLSchema-instance"
          xsi:noNamespaceSchemaLocation="schema.xsd">
	<Item ID="id1">
		<Name>Rose</Name>
		<Note>*white rose</Note>
		<Soil>dirt</Soil>
		<VisualParameters>
			<ColorOfStem>green</ColorOfStem>
			<ColorOfLeaf>green</ColorOfLeaf>
			<AverageSize>
				<Value>50</Value>
				<Type>sm</Type>	
			</AverageSize>
		</VisualParameters>
		<GrowingTips>
			<Temperature>
				<TemperatureValue>18</TemperatureValue>
				<Type>C</Type> 
			</Temperature>
			<Lighting>yes</Lighting>
			<Watering>700</Watering>
		</GrowingTips>
		<Multiplying>cuttings</Multiplying>
	</Item>
	<Item ID="id2">
		<Name>Violet</Name>
		<Soil>dirt</Soil>
		<VisualParameters>
			<ColorOfStem>dark green</ColorOfStem>
			<ColorOfLeaf>dark green</ColorOfLeaf>
			<AverageSize>
				<Value>15</Value>
				<Type>sm</Type>	
			</AverageSize>
		</VisualParameters>
		<GrowingTips>
			<Temperature>
				<TemperatureValue>15</TemperatureValue>
				<Type>C</Type> 
			</Temperature>
			<Lighting>no</Lighting>
			<Watering>350</Watering>
		</GrowingTips>
		<Multiplying>leaves</Multiplying>
	</Item>
	<Item ID="id3">
		<Name>Carnation</Name>
		<Soil>podzolic</Soil>
		<VisualParameters>
			<ColorOfStem>green</ColorOfStem>
			<ColorOfLeaf>green</ColorOfLeaf>
			<AverageSize>
				<Value>40</Value>
				<Type>sm</Type>	
			</AverageSize>
		</VisualParameters>
		<GrowingTips>
			<Temperature>
				<TemperatureValue>16</TemperatureValue>
				<Type>C</Type> 
			</Temperature>
			<Lighting>yes</Lighting>
			<Watering>550</Watering>
		</GrowingTips>
		<Multiplying>seeds</Multiplying>
	</Item>
	<Item ID="id4">
		<Name>Peony</Name>
		<Soil>podzolic</Soil>
		<VisualParameters>
			<ColorOfStem>green</ColorOfStem>
			<ColorOfLeaf>green</ColorOfLeaf>
			<AverageSize>
				<Value>55</Value>
				<Type>sm</Type>	
			</AverageSize>
		</VisualParameters>
		<GrowingTips>
			<Temperature>
				<TemperatureValue>17</TemperatureValue>
				<Type>C</Type> 
			</Temperature>
			<Lighting>yes</Lighting>
			<Watering>500</Watering>
		</GrowingTips>
		<Multiplying>seeds</Multiplying>
	</Item>
	<Item ID="id5">
		<Name>Chamomile</Name>
		<Soil>sod-podzolic</Soil>
		<VisualParameters>
			<ColorOfStem>green</ColorOfStem>
			<ColorOfLeaf>green</ColorOfLeaf>
			<AverageSize>
				<Value>70</Value>
				<Type>sm</Type>	
			</AverageSize>
		</VisualParameters>
		<GrowingTips>
			<Temperature>
				<TemperatureValue>18</TemperatureValue>
				<Type>C</Type> 
			</Temperature>
			<Lighting>yes</Lighting>
			<Watering>550</Watering>
		</GrowingTips>
		<Multiplying>seeds</Multiplying>
	</Item>
	<Item ID="id6">
		<Name>Iris</Name>
		<Soil>sod-podzolic</Soil>
		<VisualParameters>
			<ColorOfStem>green</ColorOfStem>
			<ColorOfLeaf>green</ColorOfLeaf>
			<AverageSize>
				<Value>60</Value>
				<Type>sm</Type>	
			</AverageSize>
		</VisualParameters>
		<GrowingTips>
			<Temperature>
				<TemperatureValue>16</TemperatureValue>
				<Type>C</Type> 
			</Temperature>
			<Lighting>yes</Lighting>
			<Watering>640</Watering>
		</GrowingTips>
		<Multiplying>seeds</Multiplying>
	</Item>
	<Item ID="id7">
		<Name>Gladiolus</Name>
		<Soil>sod-podzolic</Soil>
		<VisualParameters>
			<ColorOfStem>green</ColorOfStem>
			<ColorOfLeaf>green</ColorOfLeaf>
			<AverageSize>
				<Value>65</Value>
				<Type>sm</Type>	
			</AverageSize>
		</VisualParameters>
		<GrowingTips>
			<Temperature>
				<TemperatureValue>16</TemperatureValue>
				<Type>C</Type> 
			</Temperature>
			<Lighting>no</Lighting>
			<Watering>370</Watering>
		</GrowingTips>
		<Multiplying>seeds</Multiplying>
	</Item>
	<Item ID="id8">
		<Name>Narcis</Name>
		<Soil>sod-podzolic</Soil>
		<VisualParameters>
			<ColorOfStem>green</ColorOfStem>
			<ColorOfLeaf>green</ColorOfLeaf>
			<AverageSize>
				<Value>45</Value>
				<Type>sm</Type>	
			</AverageSize>
		</VisualParameters>
		<GrowingTips>
			<Temperature>
				<TemperatureValue>15</TemperatureValue>
				<Type>C</Type> 
			</Temperature>
			<Lighting>yes</Lighting>
			<Watering>460</Watering>
		</GrowingTips>
		<Multiplying>seeds</Multiplying>
	</Item>
	<Item ID="id9">
		<Name>Tulip</Name>
		<Soil>sod-podzolic</Soil>
		<VisualParameters>
			<ColorOfStem>green</ColorOfStem>
			<ColorOfLeaf>green</ColorOfLeaf>
			<AverageSize>
				<Value>55</Value>
				<Type>sm</Type>	
			</AverageSize>
		</VisualParameters>
		<GrowingTips>
			<Temperature>
				<TemperatureValue>15</TemperatureValue>
				<Type>C</Type> 
			</Temperature>
			<Lighting>no</Lighting>
			<Watering>280</Watering>
		</GrowingTips>
		<Multiplying>seeds</Multiplying>
	</Item>
</Flowers>
